{"attemptId":"F002-L008-01","authority":"derived-execution-only","caseId":"L008","createdBy":{"tool":"implementation.agent.cold_start_stage","version":"1.0"},"effectiveWriteScope":{"artifacts":["library/electronics/authoring/authoring-components.aixlib.json","library/electronics/authoring/repaired-resistor.aixsym.json","project.aixproj.json"],"authority":["component-library","project","symbol"],"constraints":[{"pattern":"**/*.aixlib.json","policy":"new-library-artifact-canonical"},{"pattern":"**/*.aixproj.json","policy":"digest-only"},{"pattern":"**/*.aixsym.json","policy":"new-library-artifact-canonical"}],"derived":["evidence/**","render/**"],"prohibited":["**/*.svg","**/project-validation.json","**/render-manifest.json","**/resolved-project-scene.json","**/resolved-scene.json","**/viewer-model.json","**/viewer.html","**/workbench.html","evidence/**","render/**"]},"excludedEvaluatorArtifacts":["evaluator/invariants.json","case secrets","scoring metadata","prior attempts","Tier A repaired fixtures","completed target render"],"formatVersion":"1.0","generatedAt":"2026-08-12T00:00:00Z","isolationProfile":{"credentialsStaged":false,"evaluatorArtifactsVisible":false,"filesystem":"fresh-copy","freshState":true,"networkPolicy":"declared-by-executor","priorAttemptsVisible":false},"readOnlyRoots":["task","reference"],"referencePack":{"bytes":858522,"digest":"sha256:cf6caad8f40cfef72142a232aa5b778a080a3fd2c765d36e0418ab976c8a8049","files":68,"root":"reference"},"schema":"https://schemas.aixem.org/agent/stage-manifest/1","stageDigest":"sha256:f5a0095b0b450376047a16bc737a2ffa7538800e7ef9dd1ff94b4404180cdf7c","startWorkspace":{"authoritativeDigest":"sha256:075d207866d4e5cb2f4c1c3254d7290b7bd13f54b09d4b411ef937fc8ffd3895","authoritativeFiles":[{"authority":"component-library","bytes":2795,"digest":"sha256:22e65f4ce4866c5f89d5d30d2e3689cd0ecab4e1db1b16fc4b7c46beddc805e5","path":"library/electronics/authoring/authoring-components.aixlib.json","role":"authoritative"},{"authority":"symbol","bytes":6928,"digest":"sha256:3e9c3ad9c2591679232b35c63d6ee44abc1114ec45ce309064338dc4d0ecbda4","path":"library/electronics/authoring/repaired-resistor.aixsym.json","role":"authoritative"},{"authority":"project","bytes":2330,"digest":"sha256:03d7e7fd8f32b5a2571d5dd52022764d3e44b4f74cf390922488d6d43294c848","path":"project.aixproj.json","role":"authoritative"},{"authority":"semantic","bytes":217,"digest":"sha256:fd631efc9f3b87c291a27fa663266a17a0c574a95c9e92468364a3f0751f368c","path":"visual_repair.aixem","role":"authoritative"},{"authority":"layout","bytes":1876,"digest":"sha256:16648e277333dc15e551ab8ffe404a210c2d8432c31a38268541785f18fc3063","path":"visual_repair.aixlayout.json","role":"authoritative"}],"files":6,"root":"workspace","snapshotDigest":"sha256:53bf6e1083fe70f60b2f56922963aa170ddabe8b58d701d5bab8f1e7fffed7e3"},"targetLeakageCheck":{"filesScanned":76,"matches":[],"valid":true},"task":{"activeRoute":"create-symbol","digest":"sha256:bdbe7bec04ca92bd4fd3fd3db2449dc8c59654855360def48d3e2fa0d3ffaa62","entryRoute":"create-symbol","path":"task/agent-task.json","routeResolutionDigest":"sha256:466ae175f63072a4f7a9f752688aa125ef50a050d06d0be38fe70d2390002e4a"},"visibleFiles":[{"bytes":8111,"digest":"sha256:5e3729835e6ec4b6d4d6f2cc4f836f6645fe264dc25d2f4927b573b300a2394d","path":"reference/AGENTS.md"},{"bytes":1699,"digest":"sha256:625420477d6544a7ca5fa42ccf222f75a15a50007c68f457caba13515c09745f","path":"reference/START_HERE.md"},{"bytes":6,"digest":"sha256:dcdecbc7866cc9413935ee7a76b92beba1e4494f63aa0df5d8b5afe979d16260","path":"reference/VERSION"},{"bytes":95279,"digest":"sha256:426aef9cfdf8fa0312dd58bb26149ba75ce4037445eb5d5a638bd9d18e5b6dd5","path":"reference/docs/_meta/generated/route-index.json"},{"bytes":7281,"digest":"sha256:83eeed3b1727037db1f48f63a9bb0a6d39ae1b51667ed0ad72c988b07bd3f762","path":"reference/docs/_meta/generated/task-packets/create-symbol.json"},{"bytes":9692,"digest":"sha256:e2d27d9cbcae0e5f65c2d360fb01e0ab5c942d69742c7ee91af6b1c78bea4046","path":"reference/docs/file-formats/aixlib.md"},{"bytes":12836,"digest":"sha256:b1206ca1354feb677fa228b8180a620fde01ed8d88492b870b7491af77d411cf","path":"reference/docs/file-formats/aixsym.md"},{"bytes":13986,"digest":"sha256:3b69de52984770c79e996584ce3936cbb344f03417a80e037d60c087127e60ad","path":"reference/docs/specifications/components/library-layout-contract.md"},{"bytes":11768,"digest":"sha256:2efaa8b0b08c67f2c088d407b6a799dc462552f7d423a8f5411d5497595735c7","path":"reference/docs/specifications/components/pin-electrical-semantics-profile.md"},{"bytes":1765,"digest":"sha256:b76e0927584abdeb6073e653d7d4212f823351bbd6ca070a1a9db8920ffe70c9","path":"reference/docs/specifications/schemas/agent/aixem-agent-attempt-set-1.schema.json"},{"bytes":4641,"digest":"sha256:91950bc067897595795effae3647477881bf3bf64040891ee4be5e5d9a89acd3","path":"reference/docs/specifications/schemas/agent/aixem-agent-change-set-1.schema.json"},{"bytes":1898,"digest":"sha256:d5d54e03dcac813c3adbd88d6f18dc4c79fdd620ae01f8be2a40ac7bf9dd5a5e","path":"reference/docs/specifications/schemas/agent/aixem-agent-diagnostic-1.schema.json"},{"bytes":3772,"digest":"sha256:00b4641187909362aba8a717f5e309723d3c9ab504582691b74f9edaf3bea42a","path":"reference/docs/specifications/schemas/agent/aixem-agent-evaluation-invariant-1.schema.json"},{"bytes":4121,"digest":"sha256:656cf4765779308fe2caae5eda39fd0ea7c881b39bd93127dccf0c924967c63b","path":"reference/docs/specifications/schemas/agent/aixem-agent-executor-1.schema.json"},{"bytes":3796,"digest":"sha256:dd5016bca66842357eb0fc048a2be7768410fc2ff35bb9c9cc41416d6c0725e2","path":"reference/docs/specifications/schemas/agent/aixem-agent-live-run-1.schema.json"},{"bytes":1134,"digest":"sha256:9caedd0cec1240c74ccb564027c049ebc5e42a25ad6b1f982a8119cb9097fd22","path":"reference/docs/specifications/schemas/agent/aixem-agent-observation-event-1.schema.json"},{"bytes":7802,"digest":"sha256:4dee7a7e00c3316badfba9b2d95bc32134d3bbcd7b5f0c5f0dd1cbe6598776f1","path":"reference/docs/specifications/schemas/agent/aixem-agent-run-record-1.schema.json"},{"bytes":4631,"digest":"sha256:38e61a85cf9ea38b2d4d13cc7b0d72e001cd4a93b1af98f1884c21540a5433d7","path":"reference/docs/specifications/schemas/agent/aixem-agent-stage-manifest-1.schema.json"},{"bytes":2153,"digest":"sha256:2ff689e872fc57aae77bd708d011d322d62cf0172c5d3490a006f953243c2d05","path":"reference/docs/specifications/schemas/agent/aixem-agent-task-1.schema.json"},{"bytes":9642,"digest":"sha256:85d1977d263f0ee6f86db615c2f4b9c43fbd1e534b1446f5fcdb2b58e16417cc","path":"reference/docs/specifications/schemas/component-graphics-1/aixem-component-library-1.schema.json"},{"bytes":17883,"digest":"sha256:4f92e5e292a694aabfca922cc449f2f59a1a08e6465181a096a62b47b23bfca7","path":"reference/docs/specifications/schemas/component-graphics-1/aixem-explicit-layout-1.schema.json"},{"bytes":4546,"digest":"sha256:056932ff46d7b6928f3b01dba50403353bdfda8f4d28e8b7bf0d38ab1dd39a41","path":"reference/docs/specifications/schemas/component-graphics-1/aixem-project-manifest-1.schema.json"},{"bytes":51899,"digest":"sha256:ba4d442591f6e53daf07f9d8f85e2026043f4e93ae0710e2578447dd3c466831","path":"reference/docs/specifications/schemas/component-graphics-1/aixem-symbol-asset-1.schema.json"},{"bytes":19027,"digest":"sha256:7025139f1e56ab3e95bb591d63fe452b468575a30948041eb9d3f6a22908c996","path":"reference/docs/specifications/schemas/component-graphics-2/aixem-explicit-layout-2.schema.json"},{"bytes":6753,"digest":"sha256:67837938322d173bbf969d7ae571c21418a08e329d7731b87e704a00d88f13cb","path":"reference/docs/specifications/schemas/component-graphics-2/aixem-project-manifest-2.schema.json"},{"bytes":5264,"digest":"sha256:163539913a56b1a6cae8a87113c9ad99f197f547a406419fed7cbb84891cc3e9","path":"reference/docs/specifications/schemas/index.md"},{"bytes":2825,"digest":"sha256:8de0f9d899b45b4bc0907ce177c26ca79797d310c0fb417f102db90f7db63ba9","path":"reference/docs/specifications/schemas/reference-compatibility-1/aixem-artifact-map-1.schema.json"},{"bytes":2891,"digest":"sha256:48128f752517b70a0efcf25468dca0a219afb44d168d05cef973655dba0d41ab","path":"reference/docs/specifications/schemas/reference-compatibility-1/aixem-capability-index-1.schema.json"},{"bytes":5447,"digest":"sha256:9010581b913dbd75f83033750cf99b315afcf1b87cea699b6afaa02f0270b9c6","path":"reference/docs/specifications/schemas/reference-compatibility-1/aixem-reference-card-1.schema.json"},{"bytes":1779,"digest":"sha256:89cd13142bad5473d456a59976fce64c9144b989e7e23e92d968d4dbb18612b7","path":"reference/docs/specifications/schemas/reference-compatibility-1/aixem-reference-domain-index-1.schema.json"},{"bytes":1884,"digest":"sha256:b2591ae758e9fc4fc8f2900cf8b477b8ef2ade5ccd9b043fea204db73e25a919","path":"reference/docs/specifications/schemas/reference-compatibility-1/aixem-reference-manifest-1.schema.json"},{"bytes":5112,"digest":"sha256:00b831043495014d7d2124d4b6fb2b06edd6af8770ec21e1afd13390644dc3d5","path":"reference/docs/specifications/schemas/reference-compatibility-1/aixem-reference-root-1.schema.json"},{"bytes":7495,"digest":"sha256:da13c5dc836cc89fceccbc2d7e51bb70a29e3de6f4e8004e390c768f9960d940","path":"reference/docs/specifications/schemas/reference-compatibility-1/aixem-schematic-style-1.schema.json"},{"bytes":5229,"digest":"sha256:4088a978378a7bad4961ffcdbb2a2534213c20fbf0044af2cde2b77ca46010a7","path":"reference/docs/specifications/schemas/reference-compatibility-1/aixem-task-route-1.schema.json"},{"bytes":8077,"digest":"sha256:19ddd388558a6cd232de0ea13fe02daa6ae2d13016da3f0a336851bb473da54b","path":"reference/docs/specifications/schemas/viewer/aixem-viewer-model-1.schema.json"},{"bytes":10379,"digest":"sha256:ed7e12ded56ddcc7ff3154ef967a0c780c8a6dbb7d9a4f5dcde732a8500b0e53","path":"reference/docs/specifications/symbols/symbol-design-profile.md"},{"bytes":9595,"digest":"sha256:ab00aba15fcf380926bc2c8613c1d1b314bd26c4650a8b2761f69093a4cba5fd","path":"reference/docs/symbols/component-symbol-binding.md"},{"b